KANJI	VI	EN	ELEMENT	STORY	LESSON	JLPT
平	bình	even	lily pad;	There's an even covering of water lilies on the pond at 金閣寺 （きんかくじ） the Golden Pavilion in Kyoto.	39.00	3.00	deck#3	due@2025-08-26 23:09:28
呼	hô	call	mouth; lily pad;	"I'm a lazy fisher, so I genetically engineered a lily pad with a fishing hook at the stem and a mouth to call me whenever it catches something."	39.00	3.00	deck#4	due@2025-09-18 23:39:03
刹	sát	moment	sheaf; tree; saber;	The kendo artist takes a brief moment to practice his skills: he throws sheafs over the tree and tries to cut them with his saber when they come down again.	39.00	5.00	deck#4	due@2025-09-18 23:09:22
希	hi	hope	sheaf; linen;	"Most people outside the first world hope only for food and clothing - a sheaf of wheat, a bolt of linen."	39.00	2.00	deck#4	due@2025-09-18 23:38:57
胸	hung	bosom	part of the body; bound up; villain;	Bosom is a Flesh part that should be bound up lest it provoke villian thoughts.	39.00	2.00	deck#2	due@2025-08-20 23:12:01
殺	sát	kill	sheaf; tree; cruise missile;	"Wolverine (sheaf, see reap (#1488 刈)) leaps over a tree and with one swipe of his claws kills a bad guy aiming a missle launcher."	39.00	3.00	deck#4	due@2025-09-18 23:09:15
純	thuần	genuine	thread; earthworm;	ou need to attach a genuine earthworm to the thread. With plastic bait you won't catch anything.	39.00	2.00	deck#2	due@2025-08-20 23:13:06
頓	đốn	immediate	earthworm; head;	Ever chopped the head off an earthworm? Notice how it will grow back immediately!	39.00	5.00	deck#4	due@2025-09-18 23:25:16
鈍	độn	dull	metal; earthworm;	The metal hook is too dull to even pierce an earthworm….	39.00	2.00	deck#2	due@2025-08-20 23:37:38
辛	tân	spicy	stand up; ten;	"Eating spicy food makes you stand up ten times faster than usual, 'cause you just need to get something to drink!"	39.00	2.00	deck#4	due@2025-09-18 23:12:10
辞	từ	resign	tongue; spicy;	A lecherous male worker is forced to resign because the female employees compained about his spicy tounge.	39.00	3.00	deck#4	due@2025-09-18 23:36:52
璧	bích	holed gem	ketchup; jewelry;	"This kanji shows a policeman with a holed gem (which can be thought of as jewelry, I guess), but he thinks it's a doughnut. For some reason though, he liked his doughnuts with ketchup on them, so he added some, and tried to take a bite. He lost a few teeth on the process."	39.00	5.00	deck#2	due@2025-08-20 23:12:46
新	tân	new	red pepper; axe;	"Axe-man grows a patch of red pepper plants in his back garden. He rubs red peppers on the edge of his axes, and this seems to keep them sharp like brand new."	39.00	4.00	deck#4	due@2025-09-18 23:38:46
親	thân	parent	red pepper; see;	I remember this one the way the Japanese do: a parent standing on top of a tree watching what hisor her kid is doing.	39.00	4.00	deck#4	due@2025-09-18 23:41:53
幸	hạnh	happiness		「幸せから一本取ると辛い」	39.00	3.00	deck#4	due@2025-09-18 23:42:38
摯	chí	clasp	tenacious; hand;	Tenaciously clasping something with your hand.	39.00	5.00	deck#3	due@2025-08-26 23:40:12
報	báo	report	happiness; stamp; crotch;	"Recall the fashion model wearing just a stamp over his crotch (clothing (#1399 服)). When he got happy, of course, it ended up in the news report."	39.00	3.00	deck#4	due@2025-09-18 23:38:25
叫	khiếu	shout	mouth; cornucopia	You can hold a CORNUCOPIA up to your MOUTH (like a megaphone) to SHOUT lounder.	39.00	2.00	deck#4	due@2025-09-18 23:41:39
収	thu	income	cornucopia; crotch	Prostitutes can make a veritable cornucopia of income by using their crotches	39.00	3.00	deck#4	due@2025-09-18 23:41:22
陸	lục	land	pinnacle; rice seedlings; soil;	"When sailors see land in the distance, they first see the pinnacles of the new land, but when they come close enough they'll be able to make out the rice seedlings, and finally the ground!"	39.00	2.00	deck#2	due@2025-08-20 23:42:50
勢	thế	forces	rice seedlings; round; power;	The rice-seedlings still stuck in the soil gather round in a circle. Their combined power forces them out of the ground at last.	39.00	2.00	deck#2	due@2025-08-20 23:42:12
熱	nhiệt	heat	rice seedlings; fat man; fire;	This is the fever the fat man feed after plant the rice seedings	39.00	3.00	deck#2	due@2025-08-20 23:43:16
菱		diamond	flowers; rice seedings; walking legs;	"Some girls want diamonds, but others will be satisfied with just flowers. However if you think you can win her over with rice seedlings, expect her to get up on her walking legs and walk on out!"	39.00	5.00	deck#2	due@2025-08-20 23:37:01
刻	khắc	engrave	acorn; saber;	STORY: The Swiss watchmaker is a master engraver. He engraves the minutes and seconds on an acorn using a tiny saber to make a miniature cuckoo clock… 遅刻 [ちこく].	39.00	3.00	deck#4	due@2025-09-18 23:38:33
骸	hài	remains	skeleton; acorn;	The remains consisted of a skeleton which had the remains of some acorns in its stomach area. Whether it died from eating the acorns remains to be seen.	39.00	5.00	deck#2	due@2025-08-20 23:38:15
述	thuật	mention	resin; road;	Why are the roads leading through the woods so sticky and dirty? Hmm… I think the forest ranger mentioned something about excess resin on the roads…	39.00	2.00	deck#2	due@2025-08-20 23:41:29
術	thuật	art	boulevard; resin;	Resin on the road -> drifting -> art of driving	39.00	3.00	deck#4	due@2025-09-18 23:42:22
寒	hàn	cold	house; celery; animal legs;	"Did you ever see that Tom ad Jerry episode where they made it so cold that the inside of the house became a winter wonderland, and Jerry grabbed some celery and used his animal legs to skate and sled around on the ice? It was a real celery-bration, ha ha… ha.."	39.00	3.00	deck#4	due@2025-09-18 23:17:21
塞	thuật	block up	house; cold; dirt;	The A/C wasn't making the house cold because the filters had been blocked up with dirt.	39.00	5.00	deck#4	due@2025-09-18 23:10:45
#--decks immediate,daily,weekly,monthly,quarterly,yearly
#--intervals 0,1440,10080,43200,129600,518400
#--showcolumns KANJI
#--showcolumns KANJI,VI,EN,ELEMENT,STORY
