KANJI	VI	EN	ELEMENT	STORY	LESSON	JLPT
貝	bối	shellfish	clam; oyster; eye; animal legs; eight		4	2	deck#6	due@2026-08-14 09:16:22
員	viên	employee	mouth; shellfish; clam; oyster; eye; animal legs; eight		4	4	deck#6	due@2026-01-08 13:45:38
貼	thiếp	post a bill	shellfish; fortune-telling;	Fortune teller writes your fortune on a piece of paper and tells you to affix it to a shell and throw into the ocean for it to come true. Picture licking the back of the shell like a stamp and affixing it to the fortune.	4	5	deck#6	due@2026-01-08 13:45:58
見	kiến	see	eye; human legs		4	5	deck#6	due@2026-01-08 13:45:59
児	nhi	newborn babe	olden times; stick; sun; day; human legs		4	2	deck#6	due@2026-01-08 13:46:00
元	nguyên	beginning	two; human legs		4	4	deck#6	due@2026-01-08 13:46:01
頁	hiệt	page	one; ceiling; drop; shellfish; clam; oyster; eye; animal legs; eight		4	5	deck#6	due@2026-01-08 13:46:02
負	phụ	defeat	bound up; shellfish; clam; oyster; eye; animal legs; eight		4	3	deck#6	due@2026-01-08 13:46:03
万	vạn	ten thousand	one; ceiling; bound up		4	5	deck#6	due@2026-01-08 13:46:04
肌	cơ	texture	moon; month; flesh; part of the body; wind		4	2	deck#6	due@2026-01-08 13:46:05
的	đích	bull's eye	bull’s eye; white; dove; ladle; bound up; drop		4	5	deck#6	due@2026-01-08 13:46:05
首	thủ	neck	horns; nose; one; ceiling; drop; eye		4	3	deck#6	due@2026-01-08 13:46:06
#--decks immediate,daily,weekly,monthly,quarterly,yearly
#--intervals 0,1440,10080,43200,129600,518400
#--showcolumns KANJI
#--showcolumns KANJI,VI,EN,ELEMENT,STORY
