KANJI	VI	EN	ELEMENT	STORY	LESSON	JLPT
乱	loạn	riot	tongue; thousand; drop; ten; needle; mouth; fishhook		5	2	deck#6	due@2026-01-08 13:46:45
直	trực	straightaway	ten; needle; eye; fishhook		5	3	deck#6	due@2026-01-08 13:46:46
具	cụ	tool	eye; one; animal legs; eight		5	3	deck#6	due@2026-01-08 13:46:48
真	chân	true	ten; needle; eye; tool; one; animal legs; eight		5	4	deck#6	due@2026-01-08 13:46:48
工	công	craft	artificial		5	4	deck#6	due@2026-01-08 13:46:49
左	tả	left	by one’s side; craft		5	5	deck#6	due@2026-01-08 13:46:50
右	hữu	right	by one’s side; mouth		5	5	deck#6	due@2026-01-08 13:46:51
有	hữu	possess	by one’s side; moon; month; flesh; part of the body		5	4	deck#6	due@2026-01-08 13:46:52
切	thiết	cut	seven; diced; sword; dagger		5	4	deck#6	due@2026-01-08 13:46:52
召	chiêu	seduce	sword; dagger; mouth		5	2	deck#6	due@2026-01-08 13:46:53
則	tắc	rule	shellfish; clam; oyster; eye; animal legs; eight; sword; sabre; saber		5	2	deck#6	due@2026-01-08 13:46:54
副	phó	vice-	wealth; one; ceiling; mouth; rice field; brains; sword; sabre; saber		5	2	deck#6	due@2026-01-08 13:46:55
別	biệt	separate	mouth; bound up; sword; sabre; saber		5	4	deck#6	due@2026-01-08 13:46:56
町	đinh	village	rice field; brains; street; nail; spike		5	4	deck#6	due@2026-01-08 13:46:57
可	khả	can	mouth; street; street; nail; spike		5	5	deck#6	due@2026-01-08 13:46:57
頂	đỉnh	place on the head	street; nail; spike; head; page; one; ceiling; drop; shellfish; clam; oyster; eye; animal legs; eight		5	3	deck#6	due@2026-01-08 13:46:58
#--decks immediate,daily,weekly,monthly,quarterly,yearly
#--intervals 0,1440,10080,43200,129600,518400
#--showcolumns KANJI
#--showcolumns KANJI,VI,EN,ELEMENT,STORY
