KANJI	VI	EN	ELEMENT	STORY	LESSON	JLPT
単	đơn	simple	owl; rice field; brains; ten; needle		53.00	3.00		
戦	chiến	war	simple; owl; rice field; brains; ten; needle; fiesta		53.00	3.00		
脳	não	brain	moon; month; flesh; part of the body; owl; villain; sheaf; shovel		53.00	2.00		
悩	não	trouble	Freud; state of mind; owl; villain; sheaf; shovel		53.00	2.00		
鳥	điểu	bird	white; dove; one; tail feathers		53.00	4.00		
鳴	minh	chirp	mouth; bird		53.00	3.00		
烏	ô	crow	drop; mouth; one; tail feathers		53.00	5.00		
島	đảo	island	bird; mountain		53.00	2.00		
偶	ngẫu	accidentally	person; talking cricket; brains; insect; belt		53.00	3.00		
隅	ngung	corner	pinnacle; parthenon; acropolis; talking cricket; brains; insect; belt		53.00	2.00		
逆	nghịch	inverted	mountain goat; horns; mountain; road		53.00	2.00		
遡	tố	go upstream	first day of the month; mountain goat; horns; mountain; moon; month; flesh; part of the body; road		53.00	5.00		
岡	cương	Mount	mount; glass canopy; hood; mountain goat; horns; mountain		53.00	5.00		
缶	phẫu	tin can	noon; sign of the horse; shovel		53.00	2.00		
鬱	uất	gloom			53.00	5.00		
蹴	xúc	kick	wooden leg; mouth; stop; footprint; concerning; capital; tall; top hat; mouth; small; little; understandably; chihuahua with one human leg		53.00	5.00		
貌	mạo	countenance	skunk; badger; white; dove; human legs		53.00	5.00		
晩	vãn	nightfall	sun; day; village stocks; rabbit; bound up; human legs		53.00	3.00		
勉	miễn	exertion	village stocks; rabbit; bound up; human legs; power; muscle; arnold		53.00	4.00		
象	tượng	elephant	colour; color; bound up; sow; pig		53.00	2.00		
像	tượng	statue	person; elephant; colour; color; bound up; sow; pig		53.00	2.00		
#--decks immediate,daily,weekly,monthly,quarterly,yearly
#--intervals 0,1440,10080,43200,129600,518400
#--showcolumns KANJI
#--showcolumns KANJI,VI,EN,ELEMENT,STORY
